{
  "schema_version": "1.0.0",
  "id": "replay-000042",
  "content_hash": "sha256:9f86d081884c7d659a2feaa0c55ad015a3bf4f1b2b0b822cd15d6c15b0f00a08",
  "source": "replay",
  "feed": "synthetic-markets",
  "url": "https://example.invalid/replay/000042",
  "title": "example corp reports stronger quarterly revenue",
  "body": "synthetic sample example corp said on monday that quarterly revenue rose versus a year earlier citing stronger demand across its product lines this text is synthetic and does not describe any real company or event",
  "language": "en",
  "published_at": "2026-07-20T17:59:00Z",
  "ingested_at": "2026-07-20T18:00:01Z",
  "processed_at": "2026-07-20T18:00:02Z",
  "tickers": ["EXMP"]
}
